ID,Name,Year,Duration,Directors,Actors,Genres,Rating
670,The Roads Not Taken,2020,85,Sally Potter,"Javier Bardem, Elle Fanning, Branka Katic",Drama,5.2
671,Blood and Money,2020,89,John Barr,"Tom Berenger, Kristen Hager, Paul Ben-Victor","Drama, Thriller",5.3
672,Tiki Taka,2020,104,Parambrata Chattopadhyay,"Surangama Bandyopadhyay, Paran Banerjee, Ritabhari Chakraborty","Comedy, Sport",6.9
673,Assassins,2020,104,Ryan White,"Siti Aisyah, Hadi Azmi, Anna Fifield","Documentary, Biography",7.5
674,Earth and Blood,2020,80,Julien Leclercq,"Sami Bouajila, Eriq Ebouaney, Samy Seghir","Action, Drama, Thriller",5.2
675,Night of the Kings,2020,93,Philippe Lacôte,"Bakary Koné, Steve Tientcheu, Jean Cyrille Digbeu","Drama, Fantasy",6.5
676,The Banishing,2020,97,Christopher Smith,"Jessica Brown Findlay, John Heffernan, Anya McKenna-Bruce","Horror, Mystery, Thriller",4.5
677,Critical Thinking,2020,117,John Leguizamo,"John Leguizamo, Rachel Bay Jones, Michael Kenneth Williams",Drama,6.5
678,Trump Card,2020,103,"Debbie D'Souza, Dinesh D'Souza, Bruce Schooley","Stephen Brodie, Dinesh D'Souza, John Di Domenico",Documentary,4.5
679,One Night in Bangkok,2020,105,Wych Kaosayananda,"Mark Dacascos, Vanida Golten, Prinya Intachai","Action, Crime, Drama",5.2
680,The Last Regret,2020,90,Don Tjernagel,"Jordan Abbe, J.T. Auger, Clint Boevers",Comedy,4.3
681,Lucky,2020,83,Natasha Kermani,"Brea Grant, Leith M. Burke, Dhruv Uday Singh","Drama, Fantasy, Horror",4.9
682,Two Types of People,2020,101,Tunç Sahin,"Burcu Biricik, Pinar Deniz, Aras Aydin",Drama,6.9
683,Sacrifice,2020,87,"Andy Collier, Tor Mian","Sophie Stevens, Ludovic Hughes, Barbara Crampton","Horror, Mystery, Thriller",4.7
684,Kubrick by Kubrick,2020,65,Gregory Monro,"Stanley Kubrick, Michel Ciment, Malcolm McDowell",Documentary,7.1
685,Asphalt Burning,2020,101,Hallvard Bræin,"Anders Baasmo, Sven Nordin, Otto Jespersen","Action, Comedy",5.2
686,Greatland,2020,104,Dana Ziyasheva,"Shannon Briggs, Nhya Cedon, Ellen Clifford","Fantasy, Sci-Fi",4.6
687,World Cup Heist,2020,80,Lee Westwick,"Lee Westwick, Swaylee Loughnane, David P Perlmutter","Crime, Drama, Sport",2.9
688,The Stylist,2020,105,Jill Gevargizian,"Najarra Townsend, Brea Grant, Jennifer Seward","Drama, Horror",5.6
689,Gagarine,2020,98,"Fanny Liatard, Jérémy Trouilh","Alseni Bathily, Lyna Khoudri, Jamil McCraven","Drama, Fantasy",6.7
690,A Christmas Gift from Bob,2020,92,Charles Martin Smith,"Bob the Cat, Luke Treadaway, Ella Jarvis","Drama, Family",6.4
691,The Family Tree,2020,131,Jorge Ameer,"Michael Joseph Nelson, Keith Roenke, Anaïs Lucia",Drama,4.8
692,Honeydew,2020,106,Devereux Milburn,"Barbara Kingsley, Stephen D'Ambrose, William Aydelott",Horror,4.4
693,As I Am,2020,62,Anthony Bawn,"Andre Myers, Jerimiyah Dunbar, Tom McLaren","Drama, Fantasy, Romance",4.7
694,Preparations to Be Together for an Unknown Period of Time,2020,95,Lili Horvát,"Natasa Stork, Viktor Bodó, Benett Vilmányi","Drama, Romance",6.5
695,Belushi,2020,108,R.J. Cutler,"John Belushi, Tanner Colby, Tom Schiller","Documentary, Biography",7.2
696,The Closet,2020,97,Kwang-bin Kim,"Ha Jung-woo, Yool Heo, Kim Nam-gil","Horror, Mystery",5.7
697,Never Gonna Snow Again,2020,116,"Malgorzata Szumowska, Michal Englert","Alec Utgoff, Maja Ostaszewska, Agata Kulesza","Comedy, Drama, Mystery",6.4
698,Coded Bias,2020,86,Shalini Kantayya,"Joy Buolamwini, Meredith Broussard, Cathy O'Neil",Documentary,6.8
699,Ballad of a White Cow,2020,105,"Maryam Moghadam, Behtash Sanaeeha","Maryam Moghadam, Alireza Sani Far, Pourya Rahimi Sam",Drama,7.1
700,Lapsis,2020,108,Noah Hutton,"Dean Imperial, Madeline Wise, Babe Howard","Drama, Mystery, Sci-Fi",6.2
701,Given,2020,59,Hikaru Yamaguchi,"Kotaro Asanuma, Shintarô Asanuma, Takuya Eguchi","Animation, Drama, Music",7.7
702,Betrayed,2020,126,Eirik Svensson,"Jakob Oftebro, Pia Halvorsen, Michalis Koutsogiannakis","Drama, History, War",7.1
703,Uncle Peckerhead,2020,97,Matthew John Lawrence,"Mike Lawrence, David Littleton, Chet Siegel","Comedy, Horror, Music",5.9
704,Feral State,2020,84,Jon Carlo,"AnnaLynne McCord, Ronnie Gene Blevins, Octavio Pisano",Thriller,4.7
705,Little Big Women,2020,123,Joseph Chen-Chieh Hsu,"Shu-Fang Chen, Ying-Hsuan Hsieh, Vivian Hsu","Drama, Family",7.2
706,Schoolgirls,2020,97,Pilar Palomero,"Andrea Fandos, Natalia de Molina, Zoé Arnao",Drama,6.4
707,The Main Event,2020,101,Jaime Eliezer Karas,"Seth Carr, Tichina Arnold, Adam Pally","Action, Comedy, Family",4.8
708,Pattas,2020,141,R.S. Durai Senthilkumar,"Dhanush, Sneha, Mehreen Pirzada","Action, Drama",6.1
709,English Dogs,2020,85,Taffy Edwards,"Byron Gibson, Ron Smoorenburg, Leigh Barwell","Action, Crime, Thriller",3.6
710,Kartoffelsalat 3 - Das Musical,2020,92,Michael David Pate,"Marta Shkop, Lea Mirzanli, Nicole Cross",Musical,4.2
711,The Oak Room,2020,90,Cody Calahan,"RJ Mitte, Peter Outerbridge, Ari Millen","Mystery, Thriller",5.6
712,The Evil Next Door,2020,87,"Tord Danielsson, Oskar Mellander","Dilan Gwyn, Eddie Eriksson Dominguez, Linus Wahlgren","Horror, Mystery, Thriller",5.2
713,Dwitiyo Purush,2020,129,Srijit Mukherji,"Prosenjit Chatterjee, Parambrata Chattopadhyay, Srijit Mukherji","Drama, Mystery, Thriller",6.1
714,High Ground,2020,104,Stephen Johnson,"Guruwuk Mununggurr, Wakarra Gondarra, Mark Garrawurra","Action, Drama, Thriller",6.6
715,Memories of My Father,2020,136,Fernando Trueba,"Javier Cámara, Nicolás Reyes Cano, Juan Pablo Urrego","Drama, History",7.2
716,M.O.M. Mothers of Monsters,2020,98,Tucia Lyman,"Sevan Aliksanian, Edward Asner, Cynthia Bell","Drama, Horror, Thriller",5.8
717,Quarantine Girl,2020,61,"Nicole D'Angelo, Gregory Hatanaka","Nicole D'Angelo, Shane Ryan-Reid, Lisa London","Horror, Thriller",3.0
718,Then Came You,2020,97,Adriana Trigiani,"Craig Ferguson, Kathie Lee Gifford, Ford Kiernan","Comedy, Drama, Romance",5.9
719,Nathan's Kingdom,2020,93,Olicer J. Muñoz,"Madison Ford, Jacob Lince, Peter Mendoza","Adventure, Drama, Sci-Fi",4.7
720,The Bay of Silence,2020,93,Paula van der Oest,"Claes Bang, Olga Kurylenko, Brian Cox","Adventure, Drama, Mystery",4.5
721,Cosmoball,2020,118,Dzhanik Fayziev,"Viktoriya Agalakova, Georgiy Bestaev, Khristina Blokhina","Action, Sci-Fi, Sport",4.7
722,Pokémon the Movie: Secrets of the Jungle,2020,99,Tetsuo Yajima,"Sarah Natochenny, Kimlinh Tran, Edward Bosco","Animation, Action, Adventure",6.4
723,Klovn the Final,2020,94,Mikkel Nørgaard,"Frank Hvam, Casper Christensen, Mia Lyhne",Comedy,6.6
724,"Crazy, Not Insane",2020,119,Alex Gibney,"Dorothy Otnow Lewis, Catherine Yeager, Richard Burr","Documentary, Biography, Crime",6.9
725,Hunted,2020,87,Vincent Paronnaud,"Lucie Debay, Arieh Worthalter, Ciaran O'Brien","Action, Horror, Thriller",5.3
726,Brothers by Blood,2020,105,Jérémie Guez,"Matthias Schoenaerts, Joel Kinnaman, Maika Monroe","Action, Crime, Drama",5.1
727,City of Salt,2020,115,"Alicia Oberle Farmer, John D. Farmer","Colt Brown, Charla Bocchicchio, Wren Barnes","Drama, Mystery",3.2
728,The Last Matinee,2020,88,Maximiliano Contenti,"Ricardo Islas, Luciana Grasso, Franco Durán","Horror, Thriller",5.8
729,Guest House,2020,84,Sam Macaroni,"Pauly Shore, Mike Castle, Aimee Teegarden",Comedy,4.4
730,Hosts,2020,89,"Adam Leader, Richard Oakes","Neal Ward, Frank Jakeman, Samantha Loxley",Horror,4.3
731,Lorelei,2020,111,Sabrina Doyle,"Jena Malone, Pablo Schreiber, Ryan Findley",Drama,6.4
732,Unpaused,2020,113,"Nikkhil Advani, Avinash Arun, Tannishtha Chatterjee","Gulshan Devaiah, Saiyami Kher, Richa Chadha","Drama, Romance",7.0
733,All Hands on Deck,2020,95,Guillaume Brac,"Eric Nantchouang, Salif Cissé, Édouard Sulpice","Comedy, Drama",7.0
734,Algorithm: BLISS,2020,101,"Isak Borg, Dena Hysell-Cornejo","Sean Faris, Sarah Roemer, James Saito","Drama, Horror, Romance",4.3
735,Getaway,2020,76,Toran Caudell,"Jaclyn Betham, Scout Taylor-Compton, Landry Allbright","Crime, Fantasy, Horror",4.3
736,30 Years and 15 Minutes,2020,95,Stefan Mandachi,"Stefan Mandachi, Cezar Ionascu, Liviu Dragnea","Documentary, Animation",8.5
737,Audrey,2020,100,Helena Coan,"Audrey Hepburn, Alessandra Ferri, Francesca Hayward","Documentary, Biography, History",7.1
738,Mark of the Devil,2020,82,Diego Cohen,"Eduardo Noriega, Eivaut Rischen, Arantza Ruiz",Horror,3.2
739,Shylock,2020,130,Ajai Vasudev,"Mammootty, Meena, V. Jayaprakash","Action, Drama, Thriller",5.1
740,The Adventures of Açela,2020,70,Özgür Dogruöz,"Mike Carnes, Nic Ferg, Ashley Mellinger","Animation, Adventure, Comedy",2.6
741,Dreamkatcher,2020,85,Kerry Harris,"Radha Mitchell, Henry Thomas, Finlay Wojtak-Hissong","Horror, Thriller",3.8
742,100% Wolf,2020,96,Alexs Stadermann,"Loren Gray, Adriane Daff, Akmal Saleh","Animation, Adventure, Comedy",5.6
743,Walnut Tree,2020,100,Mohammad Hossein Mahdavian,"Payman Maadi, Mina Sadati, Minoo Sharifi","Drama, History, War",7.5
744,The Very Excellent Mr. Dundee,2020,88,Dean Murphy,"Paul Hogan, Dorothy Adams, Trudy Ager",Comedy,5.0
745,Miss India,2020,136,Narendra Nath,"Keerthy Suresh, Naveen Chandra, Sumanth Shailendra",Drama,3.8
746,Son of the South,2020,105,Barry Alexander Brown,"Lucas Till, Jim Klock, Michael Sirow","Biography, Drama",6.2
747,Identifying Features,2020,99,Fernanda Valadez,"Mercedes Hernández, David Illescas, Juan Jesús Varela",Drama,7.3
748,Simply Black,2020,90,"John Wax, Jean-Pascal Zadi","Jean-Pascal Zadi, Caroline Anglade, Fary",Comedy,6.4
749,The Midas Touch,2020,110,Tilman Borck,"Bejean Banner, Tilman Borck, Bernhard Bozian","Comedy, Horror",4.1
750,Siberia,2020,92,Abel Ferrara,"Willem Dafoe, Dounia Sichov, Simon McBurney","Drama, Fantasy, Horror",4.8
751,Draupathi,2020,159,"Mohan G., Stunt Mahesh","Sheela Rajkumar, Richard Rishi, Soundariya Nanjundan",Drama,3.8
752,Behind You,2020,86,"Andrew Mecham, Matthew Whedon","Addy Miller, Elizabeth Birkner, Philip Brodie",Horror,4.2
753,Penguin,2020,132,Eashvar Karthic,"Keerthy Suresh, Linga, Madhampatty Rangaraj","Drama, Mystery, Thriller",4.5
754,Executive Order,2020,103,"Lázaro Ramos, Flávia Lacerda","Alfred Enoch, Taís Araújo, Seu Jorge","Drama, Sci-Fi",6.6
755,The Red Ghost,2020,99,Andrey Bogatyrev,"Pavel Abramenkov, Anton Anosov, Yura Borisov","Action, Thriller, War",6.1
756,Masameer: The Movie,2020,110,Malik Nejer,"Shahad Alahmari, Yousef Aldakheel, Lama Alfard","Animation, Comedy",5.9
757,Beginning,2020,130,Dea Kulumbegashvili,"Ia Sukhitashvili, Rati Oneli, Kakha Kintsurashvili",Drama,6.6
758,Jailbreak Pact,2020,135,David Albala,"Alberto Ellena, Amparo Noguera, Benjamín Vicuña","Drama, Thriller",7.0
759,John Henry,2020,91,William Forbes,"Terry Crews, Jamila Velazquez, Ludacris","Drama, Thriller",3.6
760,Marionette,2020,112,Elbert van Strien,"Thekla Reuten, Elijah Wolf, Emun Elliott","Mystery, Thriller",5.9
761,Jiang Ziya,2020,110,"Teng Cheng, Li Wei","Luci Christian, Guanlin Ji, Guangtao Jiang","Animation, Action, Adventure",6.6
762,Break the Silence: The Movie,2020,89,Park Jun-soo,"BTS, RM, Jin","Documentary, Music",8.3
763,Ballad for a Pierced Heart,2020,140,Yannis Economides,"Vicky Papadopoulou, Vassilis Bisbikis, Stathis Stamoulakatos","Comedy, Crime, Drama",6.8
764,You Cannot Kill David Arquette,2020,91,"David Darg, Price James","David Arquette, Christina McLarty Arquette, Patricia Arquette","Documentary, Sport",7.1
765,The Unfamiliar,2020,89,Henk Pretorius,"Jemima West, Christopher Dane, Rebecca Hanssen","Horror, Thriller",4.1
766,Kindred,2020,101,Joe Marcantonio,"Tamara Lawrance, Edward Holcroft, Jack Lowden","Drama, Horror, Mystery",5.0
767,Useless Humans,2020,77,Stephen Ohl,"Josh Zuckerman, Rushi Kota, Davida Williams","Adventure, Comedy, Horror",4.5
768,The Academy of Magic,2020,86,"Jorgen Klubien, Cindy Robinson","Ben Diskin, Jamieson Price, Laura Megan Stahl","Animation, Fantasy",3.2
769,Elephant,2020,86,"Mark Linfield, Vanessa Berlowitz, Alastair Fothergill",Meghan Markle,"Documentary, Adventure, Biography",7.3
770,Acrylic,2020,78,Nicole D'Angelo,"Enjunaya Canton, Lisa London, Sarah Brine",Comedy,2.8
771,Hooking Up,2020,104,Nico Raineau,"Brittany Snow, Sam Richardson, Anna Akana","Comedy, Drama",5.6
772,Angels Fallen,2020,86,Ali Zamani,"Nicola Posener, Houston Rhines, Michael Teh","Horror, Sci-Fi",3.0
773,Holly Slept Over,2020,87,Joshua Friedlander,"Josh Lawson, Nathalie Emmanuel, Britt Lower",Comedy,5.6
774,The Bridge Curse,2020,88,Lester Hsi,"Ning Chang, Joe Hsieh, Cheng Ko","Horror, Mystery, Thriller",5.3
775,Assassin 33 A.D.,2020,109,Jim Carroll,"Morgan Roberts, Ilsa Levine, Donny Boaz",Sci-Fi,3.0
776,My Dad's Christmas Date,2020,91,Mick Davis,"Jeremy Piven, Olivia-Mai Barrett, Hadar Cats","Animation, Action, Adventure",5.5
777,Think Like a Dog,2020,91,Gil Junger,"Megan Fox, Josh Duhamel, Gabriel Bateman","Comedy, Drama, Family",5.2
778,Sinful,2020,74,Rich Mallery,"Nicole D'Angelo, Christina Lo, Chris Spinelli","Horror, Thriller",2.8
779,A Life of Speed: The Juan Manuel Fangio Story,2020,92,Francisco Macri,"Toto Wolff, Fernando Alonso, Jackie Stewart","Documentary, Biography, Sport",7.1
780,Transference,2020,86,Matthew Ninaber,"Melissa Joy Boerger, Jennifer Cornish, Matt Daciw","Action, Mystery, Sci-Fi",4.1
781,Stolen Season,2020,98,Pascal Payant,"Abbey Siegworth, Matthew Bilodeau, Mike Markoff",Drama,5.0
782,Slalom,2020,92,Charlène Favier,"Noée Abita, Jérémie Renier, Marie Denarnaud","Drama, Sport",6.6
783,Robin's Wish,2020,77,Tylor Norwood,"Susan Schneider, Shawn Levy, John R. Montgomery","Documentary, Biography",7.3
784,Winter,2020,76,Sergey Chernikov,"Nikita Abdulov, Aleksandr Ablyazov, Aleksey Demidov",Drama,5.2
785,How to Be a Good Wife,2020,109,Martin Provost,"Juliette Binoche, Yolande Moreau, Noémie Lvovsky","Comedy, Drama",5.8
786,Stardust,2020,109,Gabriel Range,"Johnny Flynn, Marc Maron, Jena Malone","Biography, Drama, Music",4.4
787,Console Wars,2020,92,"Blake J. Harris, Jonah Tulis","Howard Phillips, Shinobu Toyoda, Paul Rioux",Documentary,7.0
788,200 Meters,2020,96,Ameen Nayfeh,"Ali Suliman, Anna Unterberger, Motaz Malhees","Adventure, Drama",7.2
789,Min pappa Marianne,2020,110,Mårten Klingberg,"Hedda Stiernstedt, Rolf Lassgård, Lena Endre","Comedy, Drama",6.8
790,Sufna,2020,144,"Jagdeep Sidhu, Jugraj Singh","Tania, Balwinder Bullet, Lakha Lehri",Romance,8.0
791,A Werewolf in England,2020,84,Charlie Steeds,"Reece Connolly, Tim Cartwright, Natalie Martins","Comedy, Horror",3.7
792,Enter the Fat Dragon,2020,96,"Kenji Tanigaki, Aman Chang","Donnie Yen, Niki Chow, Teresa Sun-Kwan Mo","Action, Comedy",5.7
793,Intruder,2020,102,Sohn Won-Pyung,"Song Ji-hyo, Kim Mu-yeol, So Hee-jung","Mystery, Thriller",6.1
794,Turnt,2020,85,Mann Robinson,"Marian Berry, Torrei Hart, Benzino",Drama,3.3
795,Hitman: Agent Jun,2020,110,Won-sub Choi,"Kwon Sang-woo, Jeong Jun-ho, Hwang Woo-seul-hye","Action, Comedy",6.4
796,I Am Vengeance: Retaliation,2020,90,Ross Boyask,"Stu Bennett, Vinnie Jones, Jacob Anderton",Action,3.5
797,Close Encounters of the Fifth Kind,2020,120,Michael Mazzola,"Linda A'Roraha, Wendy Boast, Justice Campbell",Documentary,6.1
798,Raahu,2020,123,Subbu Vedula,"Dinesh Akki, Kishore Babu, Ganesh Bandi",Thriller,6.2
799,Goblin Slayer: Goblin's Crown,2020,85,Takaharu Ozaki,"Yûichirô Umehara, Yui Ogura, Nao Tôyama","Animation, Action, Adventure",6.6
800,Big Brother,2020,165,Siddique,"Mohanlal, Siddique, John Vijay","Action, Drama, Thriller",3.6
801,The Mystery of D.B. Cooper,2020,85,John Dower,"Jo Weber, Duane Weber, Tim Collins","Documentary, Crime, History",6.5
802,Miss Juneteenth,2020,99,Channing Godfrey Peoples,"Nicole Beharie, Liz Mikel, Marcus M. Mauldin",Drama,6.5
803,Dragon Rider,2020,91,Tomer Eshed,"Felicity Jones, Thomas Brodie-Sangster, Freddie Highmore","Animation, Adventure, Comedy",5.7
804,Spiritwalker,2020,108,Jae-geun Yoon,"Yoon Kyesang, Lim Ji-yeon, Park Yong-woo","Action, Fantasy, Mystery",6.2
805,Your Eyes Tell,2020,123,Takahiro Miki,"Yuriko Yoshitaka, Ryûsei Yokohama, Kyôsuke Yabe","Drama, Romance",7.3
806,Shawn Mendes: In Wonder,2020,83,Grant Singer,"Shawn Mendes, Camila Cabello, Brian Craigen","Documentary, Music",6.5
807,Bamfaad,2020,102,Ranjan Chandel,"Aditya Rawal, Shalini Pandey, Vijay Varma",Romance,5.8
808,30 jours max,2020,87,Tarek Boudali,"Tarek Boudali, Philippe Lacheau, Julien Arruti","Action, Comedy, Crime",5.5
809,Josep,2020,71,Aurel,"Sergi López, Emmanuel Vottero, Xavier Serrano","Animation, Biography, Drama",7.4
810,Spaceship Earth,2020,113,Matt Wolf,"Kathelin Gray, Marie Harding, William Dempster",Documentary,6.4
811,Under the Open Sky,2020,126,Miwa Nishikawa,"Kôji Yakusho, Seiji Rokkaku, Yukiya Kitamura","Crime, Drama",7.2
812,There's No Such Thing as Vampires,2020,81,Logan Thomas,"Emma Holzer, Josh Plasse, Aric Cushing",Horror,4.4
813,The Champion,2020,91,Maciej Barczewski,"Piotr Glowacki, Jan Szydlowski, Grzegorz Malecki","Biography, Drama, History",6.8
814,Night Shift,2020,98,Anne Fontaine,"Virginie Efira, Omar Sy, Grégory Gadebois","Crime, Drama, Thriller",5.4
815,The Con-Heartist,2020,128,Mez Tharatorn,"Nadech Kugimiya, Pimchanok Luevisadpaibul, Thiti Mahayotaruk","Comedy, Romance",7.1
816,Be Water,2020,105,Bao Nguyen,"Kareem Abdul-Jabbar, Muhammad Ali, Linda Lee Cadwell",Documentary,7.3
817,Occurrence at Mills Creek,2020,84,Don Swanson,"Ava Psoras, Alexa Mechling, Betsy Lynn George","Drama, Horror, Thriller",3.9
818,De Gaulle,2020,108,Gabriel Le Bomin,"Lambert Wilson, Isabelle Carré, Olivier Gourmet","Biography, Drama, History",6.1
819,The Speech,2020,87,Laurent Tirard,"Benjamin Lavernhe, Sara Giraudeau, Julia Piaton","Comedy, Drama, Romance",6.3
820,Baba Yaga: Terror of the Dark Forest,2020,97,"Svyatoslav Podgaevskiy, Nathalia Hencker","Svetlana Ustinova, Maryana Spivak, Aleksey Rozin","Adventure, Fantasy, Horror",4.7
821,"Goodbye, America",2020,101,Sarik Andreasyan,"Dmitriy Nagiev, Vladimir Yaglych, Liza Moryak","Comedy, Drama, Romance",6.7
822,Listen,2020,73,Ana Rocha,"Lúcia Moniz, Sophia Myles, Ruben Garcia",Drama,7.0
823,Delete History,2020,110,"Benoît Delépine, Gustave Kervern","Blanche Gardin, Denis Podalydès, Corinne Masiero","Comedy, Drama",5.7
824,Digimon Adventure: Last Evolution Kizuna,2020,94,Tomohisa Taguchi,"Natsuki Hanae, Yoshimasa Hosoya, Suzuko Mimori","Animation, Action, Adventure",7.5
825,Rosa's Wedding,2020,97,Icíar Bollaín,"Candela Peña, Sergi López, Nathalie Poza",Comedy,6.4
826,This Is Paris,2020,110,Alexandra Dean,"Paris Hilton, Kyle Richards, Kathy Hilton",Documentary,6.9
827,Showbiz Kids,2020,95,Alex Winter,"Cameron Boyce, Todd Bridges, Baby Peggy",Documentary,7.0
828,Dracula Sir,2020,127,Debaloy Bhattacharya,"Anirban Bhattacharya, Mimi Chakraborty, Supriyo Dutta","Crime, Thriller",7.4
829,Ka Pae Ranasingam,2020,177,P. Virumandi,"Aishwarya Rajesh, Vijay Sethupathi, Munishkanth",Drama,7.2
830,The Wedding Unplanner,2020,110,Dani de la Orden,"Belén Cuesta, Álex García, Silvia Alonso","Comedy, Romance",5.7
831,What We Wanted,2020,93,Ulrike Kofler,"Lavinia Wilson, Elyas M'Barek, Anna Unterberger",Drama,5.9
832,LX 2048,2020,103,Guy Moshe,"Juliet Aubrey, Anna Brewster, Gabrielle Cassi","Drama, Sci-Fi, Thriller",4.9
833,The Three Deaths of Marisela Escobedo,2020,109,Carlos Perez Osorio,"Juan Manuel Fraire Escobedo, Alejandro Fraire, Blanca Escobedo","Documentary, Crime",8.1
834,History of the Occult,2020,82,Cristian Ponce,"Germán Baudino, Nadia Lozano, Héctor Ostrofsky",Horror,6.4
835,The Last Frontier,2020,136,Vadim Shmelyov,"Artyom Gubin, Lubov Konstantinova, Igor Yudin","Action, Drama, War",6.5
836,Crock of Gold: A Few Rounds with Shane MacGowan,2020,124,Julien Temple,"Shane MacGowan, The Pogues, Siobhan MacGowan","Documentary, Biography, Music",7.7
837,True Mothers,2020,140,Naomi Kawase,"Hiromi Nagasaku, Arata Iura, Aju Makita",Drama,7.0
838,Innocence,2020,110,Park Sang-hyun,"Shin Hye-sun, Bae Jong-ok, Huh Joon-ho","Crime, Drama, Thriller",6.6
839,Spy Intervention,2020,93,Drew Mylrea,"Drew Van Acker, Poppy Delevingne, Blake Anderson","Action, Adventure, Comedy",3.9
840,Fractured,2020,82,Fikret Reyhan,"Hakan Salinmis, Süreyya Kilimci, Hakan Emre Unal",Drama,7.2
841,All In: The Fight for Democracy,2020,102,"Lisa Cortes, Liz Garbus","Carolyn Abrams, Robert Abrams, Stacey Abrams",Documentary,6.9
842,Days,2020,127,Tsai Ming-liang,"Kang-sheng Lee, Anong Houngheuangsy",Drama,6.6
843,That's Amore,2020,100,Dan Helbling,"Tammy Pescatelli, Dave Petti, Joe Puglisi","Comedy, Drama, Romance",5.7
844,Classmates Minus,2020,122,Hsin-yao Huang,"Jen-Shuo Cheng, Kuan-Ting Liu, Lin Na-Dou","Comedy, Drama",7.1
845,LA Originals,2020,92,Estevan Oriol,"Estevan Oriol, Mister Cartoon, Snoop Dogg",Documentary,7.2
846,Out of Shadows,2020,78,Mike Smith,"Mike Smith, Kevin M. Shipp, Brad Martin",Documentary,6.9
847,Figli,2020,97,Giuseppe Bonito,"Paola Cortellesi, Mehmet Günsür, Valerio Mastandrea","Comedy, Drama",6.2
848,Run Uje Run,2020,77,Henrik Schyffert,"Uje Brandelius, Therese Hörnqvist, Bixi Brandelius","Comedy, Drama, Music",6.9
849,The Hex,2020,82,Reine Swart,"Coco Lloyd, Mari Molefe van Heerden, Mary-Anne Barlow","Drama, Horror, Mystery",3.6
850,Waiting for Anya,2020,109,Ben Cookson,"Noah Schnapp, Thomas Kretschmann, Frederick Schmidt","Drama, Thriller, War",6.0
851,Fearless,2020,89,Cory Edwards,"Yara Shahidi, Miles Robbins, Miguel","Animation, Comedy, Family",5.0
852,Rallalo Neeru,2020,105,Kiranmayi Indraganti,"Krishna Manjusha C, Bindu Chandramouli, Altaf Hassan",Drama,8.3
853,Pvt Chat,2020,86,Ben Hozie,"Peter Vack, Julia Fox, Keith Poulson",Drama,5.8
854,Shivaji Surathkal,2020,124,Akash Srivatsa,"Ramesh Aravind, Radhika Narayan, Aarohi Narayan","Drama, Mystery, Thriller",7.1
855,Enemy Lines,2020,92,Anders Banke,"Ed Westwick, John Hannah, Tom Wisdom","Action, Drama, War",4.6
856,Adventures of a Mathematician,2020,102,Thor Klein,"Philippe Tlokinski, Esther Garrel, Sam Keeley","Biography, Drama",5.8
857,Dear Mother,2020,98,Laurent Lafitte,"Laurent Lafitte, Karin Viard, Vincent Macaigne",Comedy,5.8
858,Halahal,2020,97,Randeep Jha,"Barun Sobti, Sachin Khedekar, Manu Rishi Chadha","Crime, Drama, Mystery",7.0
859,Father There is Only One 2,2020,96,Santiago Segura,"Santiago Segura, Toni Acosta, Luna Fulgencio","Comedy, Family",5.6
860,Cowboys,2020,86,Anna Kerrigan,"Steve Zahn, Jillian Bell, Sasha Knight",Drama,6.4
861,Teddy,2020,88,"Ludovic Boukherma, Zoran Boukherma","Anthony Bajon, Christine Gautier, Ludovic Torrent","Comedy, Drama, Horror",6.0
862,Into the Darkness,2020,152,Anders Refn,"Jesper Christensen, Bodil Jørgensen, Mads Reuther","Drama, History, War",6.5
863,Secret Zoo,2020,118,Jae-gon Son,"Ahn Jae-hong, Kang So-ra, Park Yeong-gyu",Comedy,6.1
864,Wander Darkly,2020,97,Tara Miele,"Sienna Miller, Diego Luna, Beth Grant","Drama, Mystery, Thriller",5.8
865,Shortcut,2020,80,Alessio Liguori,"Jack Kane, Zanda Emlano, Zak Sutcliffe","Adventure, Fantasy, Horror",4.1
866,Historias lamentables,2020,126,Javier Fesser,"Pol López, Chani Martín, Laura Gómez-Lacueva",Comedy,6.6
867,Wildland,2020,89,Jeanette Nordahl,"Sandra Guldberg Kampp, Sidse Babett Knudsen, Joachim Fjelstrup","Crime, Drama, Thriller",5.8
868,Voice of Silence,2020,99,Hong Eui-jeong,"Yoo Ah-in, Yoo Jae-myung, Moon Seung-ah",,6.5
869,The Swing of Things,2020,93,Matt Shapira,"Chord Overstreet, Olivia Culpo, Luke Wilson",Comedy,3.0
870,Sunrise in Heaven,2020,85,Waymon Boone,"Caylee Cowan, Travis Burns, Corbin Bernsen","Drama, Romance",5.7
871,Pawn,2020,113,Dae-gyu Kang,"Sung Dong-il, Kim Hee-won, Ha Ji-Won","Comedy, Drama, Family",7.6
872,Stay Out of the F**king Attic,2020,80,Jerren Lauder,"Ryan Francis, Morgan Alexandria, Bryce Fernelius",Horror,4.5
873,My Missing Valentine,2020,119,Yu-Hsun Chen,"Patty Pei-Yu Lee, Yu Chun Lin, Xiao-Ying Bai","Comedy, Drama, Fantasy",7.1
874,Sky Sharks,2020,102,Marc Fehse,"Yan Birch, Eva Habermann, Barbara Nedeljakova","Comedy, Horror, Sci-Fi",3.6
875,Hotel Belgrade,2020,106,Konstantin Statskiy,"Milos Bikovic, Diana Pozharskaya, Ljubomir Bandovic","Comedy, Romance",6.2
876,Dreambuilders,2020,81,"Kim Hagen Jensen, Tonni Zinck","Ditte Hansen, Rasmus Botoft, Emilie Kroyer Koppel","Animation, Adventure, Comedy",6.0
877,Ana,2020,105,Charles McDougall,"Andy Garcia, Dafne Keen, Jeanne Tripplehorn","Comedy, Drama",5.9
878,Lady Driver,2020,104,Shaun Paul Piccinino,"Grace Van Dien, Sean Patrick Flanery, Christina Moore",Sport,5.8
879,After Truth: Disinformation and the Cost of Fake News,2020,95,Andrew Rossi,"Jack Burkman, Elizabeth Williamson, Molly McKew",Documentary,7.0
880,Big Boys Don't Cry,2020,90,Steve Crowhurst,"Daniel Adegboyega, Victoria Alcock, Karanja Augostos","Biography, Crime, Drama",6.7
881,The Way I See It,2020,100,Dawn Porter,"Pete Souza, Barack Obama, Ben Rhodes",Documentary,8.2
882,The Players,2020,88,Stefano Mordini,"Riccardo Scamarcio, Valerio Mastandrea, Laura Chiatti",Comedy,4.8
883,SARS-29,2020,116,"The Existentialist, Michael Szymczyk","Adam Holley, Sara Quiriconi, Bella Shaw",Drama,3.0
884,Let It Snow,2020,87,Stanislav Kapralov,"Ivanna Sakhno, Alex Hafner, Tinatin Dalakishvili","Horror, Thriller",4.4
885,Angela's Christmas Wish,2020,47,Damien O'Connor,"Anya O'Connor, Ruth Negga, Moe Dunford","Animation, Adventure, Comedy",7.1
886,Paper Spiders,2020,109,Inon Shampanier,"Lili Taylor, Stefania LaVie Owen, Peyton List",Drama,6.6
887,Caught in the Net,2020,100,"Barbora Chalupová, Vít Klusák","Sabina Dlouhá, Anezka Pithartová, Tereza Tezká","Documentary, Crime",8.0
888,Broil,2020,90,Edward Drake,"Jonathan Lipnicki, Avery Konrad, Timothy V. Murphy","Fantasy, Horror, Thriller",4.6
889,32 Weeks,2020,82,Brian Cavallaro,"Scott Bender, Ayanna S. Flemings, Patricia Galvez",Drama,5.2
890,Rising Phoenix,2020,105,"Ian Bonhôte, Peter Ettedgui","Jean-Baptiste Alaize, Ryley Batt, Ellie Cole","Documentary, Sport",8.1
891,United Nation Three Decades of Drum & Bass,2020,92,"Terry Stone, Richard Turner","Everson Allen, Antonio, Jeremy Bailey",Documentary,7.1
892,Kilometers and Kilometers,2020,129,Jeo Baby,"Tovino Thomas, India Jarvis, Joju George","Adventure, Comedy, Drama",6.4
893,The Night Doctor,2020,82,Elie Wajeman,"Vincent Macaigne, Pio Marmaï, Sara Giraudeau","Crime, Drama, Thriller",6.6
