ID,Name,Year,Duration,Directors,Actors,Genres,Rating
445,Pixie,2020,93,Barnaby Thompson,"Olivia Cooke, Fra Fee, Rory Fleck Byrne","Comedy, Crime, Thriller",5.9
446,Derek DelGaudio's In & Of Itself,2020,90,Frank Oz,"Derek DelGaudio, Hal Schulman, Jason England",Documentary,8.2
447,Feels Good Man,2020,92,Arthur Jones,"Matt Furie, Aiyana Udesen, Chris Sullivan","Documentary, Comedy",7.5
448,Ginny Weds Sunny,2020,125,Puneet Khanna,"Yami Gautam, Vikrant Massey, Ayesha Raza Mishra","Comedy, Drama, Romance",5.7
449,Dance of the 41,2020,99,David Pablos,"Alfonso Herrera, Emiliano Zurita, Mabel Cadena","Biography, Drama, History",6.8
450,Durgamati: The Myth,2020,155,Ashok G.,"Bhumi Pednekar, Arshad Warsi, Jisshu Sengupta","Horror, Thriller",4.0
451,Luz,2020,118,Jon Garcia,"Ernesto Reyes, Jesse Tayeh, Jimmy Garcia","Crime, Drama, Romance",6.6
452,The Killing of Two Lovers,2020,85,Robert Machoian,"Clayne Crawford, Sepideh Moafi, Chris Coy",Drama,6.8
453,The Forty-Year-Old Version,2020,123,Radha Blank,"Radha Blank, Peter Kim, Oswin Benjamin","Comedy, Drama",7.2
454,Ultras,2020,108,Francesco Lettieri,"Aniello Arena, Ciro Nacca, Antonia Truppo",Drama,6.2
455,One-Way to Tomorrow,2020,90,Ozan Açiktan,"Dilan Çiçek Deniz, Metin Akdülger, Tevfik Kartal","Comedy, Drama, Romance",5.6
456,Boys from County Hell,2020,88,Chris Baugh,"Jack Rowan, Nigel O'Neill, Louisa Harland","Comedy, Horror, Thriller",5.9
457,Adu,2020,119,Salvador Calvo,"Luis Tosar, Álvaro Cervantes, Anna Castillo",Drama,6.8
458,Limbo,2020,104,Ben Sharrock,"Sidse Babett Knudsen, Kenneth Collard, Amir El-Masry","Comedy, Drama",7.2
459,The Yin-Yang Master: Dream of Eternity,2020,132,Jingming Guo,"Mark Chao, Allen Deng, Ziwen Wang","Action, Drama, Fantasy",6.4
460,Kalashnikov,2020,110,Konstantin Buslov,"Yura Borisov, Olga Lerman, Artur Smolyaninov","Action, Biography, Drama",6.6
461,War of the Eltis,2020,118,Onur Bilgetay,"Gupse Özay, Merve Dizdar, Ferit Aktug","Comedy, Family",5.8
462,The Paper Tigers,2020,108,Quoc Bao Tran,"Yuji Okumoto, Ron Yuan, Matthew Page","Action, Comedy",6.3
463,David Byrne's American Utopia,2020,105,Spike Lee,"David Byrne, Jacqueline Acevedo, Gustavo Di Dalva","Documentary, Music, Musical",8.2
464,The Intergalactic Adventures of Max Cloud,2020,88,Martin Owen,"Elliot James Langridge, Shirin Daryaie, Scott Adkins","Action, Comedy, Sci-Fi",4.7
465,Oh My Kadavule,2020,151,Ashwath Marimuthu,"Ashok Selvan, Ritika Singh, Vani Bhojan","Comedy, Fantasy, Romance",8.0
466,Stand by Me Doraemon 2,2020,96,"Ryuichi Yagi, Takashi Yamazaki","Bakarhythm, Brian Beacock, Johnny Yong Bosch","Animation, Comedy, Drama",7.5
467,12 Hour Shift,2020,86,Brea Grant,"Angela Bettis, Julianne Dowler, Tom DeTrinis","Comedy, Horror, Thriller",5.5
468,5th Borough,2020,95,Steve Stanulis,"Steve Stanulis, Tara Reid, Lillo Brancato",Crime,5.3
469,The Call,2020,97,Timothy Woodward Jr.,"Lin Shaye, Tobin Bell, Chester Rushing","Horror, Mystery, Thriller",4.3
470,Scare Me,2020,104,Josh Ruben,"Josh Ruben, Aya Cash, Chris Redd","Comedy, Horror",5.7
471,Taylor Swift: Folklore: The Long Pond Studio Sessions,2020,105,Taylor Swift,"Taylor Swift, Aaron Dessner, Jack Antonoff","Documentary, Drama, Music",8.4
472,All Together Now,2020,92,Brett Haley,"Auli'i Cravalho, Rhenzy Feliz, Justina Machado","Drama, Romance",6.5
473,Welcome Home,2020,126,Pushkar Sunil Mahabal,"Kashmira Irani, Swarda Thigale, Shashi Bhushan","Crime, Drama, Horror",7.3
474,Miss Fisher & the Crypt of Tears,2020,101,Tony Tilse,"Essie Davis, Nathan Page, Rupert Penry-Jones","Adventure, Drama, Mystery",6.1
475,Safety,2020,122,Reginald Hudlin,"Jay Reeves, Javien Jackson, Thaddeus J. Mixson","Biography, Drama, Sport",6.8
476,A Babysitter's Guide to Monster Hunting,2020,98,Rachel Talalay,"Tamara Smart, Oona Laurence, Tom Felton","Comedy, Family, Fantasy",5.4
477,Herself,2020,97,Phyllida Lloyd,"Molly McCann, Clare Dunne, Ruby Rose O'Hara",Drama,7.0
478,Nobody Knows I'm Here,2020,91,Gaspar Antillo,"Jorge Garcia, Lukas Vergara, Millaray Lobos","Drama, Music",6.5
479,A Secret Love,2020,81,Chris Bolan,"Terry Donahue, Pat Henschel, Diana Bolan","Documentary, Biography, Drama",7.8
480,Bheeshma,2020,150,Venky Kudumula,"Nithiin, Rashmika Mandanna, Anant Nag","Action, Comedy, Romance",6.6
481,Alone,2020,92,Johnny Martin,"Tyler Posey, Summer Spiro, Donald Sutherland","Drama, Horror, Thriller",5.1
482,Made You Look: A True Story About Fake Art,2020,94,Barry Avrich,"Ann Freedman, M.H. Miller, Perry Amsellem","Documentary, Crime",7.0
483,The Binding,2020,93,Domenico de Feudis,"Riccardo Scamarcio, Mía Maestro, Giulia Patrignani","Drama, Horror, Thriller",4.8
484,Sky High,2020,121,Daniel Calparsoro,"Miguel Herrán, Carolina Yuste, Asia Ortega","Action, Adventure, Crime",5.6
485,Children of the Corn,2020,93,Kurt Wimmer,"Elena Kampouris, Kate Moyer, Callan Mulvey",Horror,3.8
486,The Beast,2020,97,Ludovico Di Martino,"Fabrizio Gifuni, Lino Musella, Monica Piseddu","Action, Crime, Drama",5.2
487,Amulet,2020,99,Romola Garai,"Carla Juri, Alec Secareanu, Imelda Staunton","Horror, Mystery",4.9
488,Mookuthi Amman,2020,134,"RJ Balaji, N.J. Saravanan","Nayanthara, RJ Balaji, Urvashi","Comedy, Drama, Fantasy",6.6
489,Double World,2020,110,Teddy Chan,"Henry Lau, Peter Ho, Chenhan Lin","Action, Adventure, Fantasy",6.2
490,Ghoomketu,2020,108,Pushpendra Nath Misra,"Nawazuddin Siddiqui, Ragini Khanna, Richa Chadha",Comedy,4.9
491,Magic Camp,2020,100,Mark Waters,"Adam Devine, Jeffrey Tambor, Gillian Jacobs","Comedy, Family, Fantasy",6.3
492,The Trip to Greece,2020,103,Michael Winterbottom,"Steve Coogan, Rob Brydon, Claire Keelan","Comedy, Drama",6.5
493,Minor Premise,2020,95,Frederick Schultz,"Sathya Sridharan, Paton Ashbrook, Dana Ashbrook","Drama, Sci-Fi, Thriller",5.1
494,Mother's Child,2020,127,Swaylee Loughnane,"Swaylee Loughnane, Shantel Page, Sophia Celest",Drama,7.7
495,Guilty,2020,119,Ruchi Narain,"Kiara Advani, Taher Shabbir, Akansha Ranjan Kapoor","Drama, Thriller",5.4
496,Pareeksha,2020,120,"Prakash Jha, Saurabh Choubey","Adil Hussain, Priyanka Bose, Shourya Deep",Drama,8.0
497,Chintu Ka Birthday,2020,83,"Devanshu Singh, Satyanshu Singh","Vinay Pathak, Tillotama Shome, Seema Pahwa","Comedy, Drama, War",7.7
498,Last and First Men,2020,70,Jóhann Jóhannsson,Tilda Swinton,"Fantasy, Mystery, Sci-Fi",6.7
499,The Binge,2020,98,Jeremy Garelick,"Vince Vaughn, Skyler Gisondo, Dexter Darden",Comedy,5.3
500,The Water Man,2020,91,David Oyelowo,"David Oyelowo, Amiah Miller, Lonnie Chavis","Adventure, Drama, Family",5.6
501,The Crimes That Bind,2020,99,Sebastián Schindel,"Cecilia Roth, Miguel Ángel Solá, Benjamín Amadeo","Crime, Drama, Thriller",6.7
502,Falling for Figaro,2020,104,Ben Lewin,"Christina Bennington, Danielle Macdonald, Shazad Latif","Comedy, Romance",6.5
503,The Phenomenon,2020,100,James Fox,"Peter Coyote, Chris Mellon, William T. Coleman",Documentary,7.4
504,Chick Fight,2020,97,Paul Leyden,"Malin Akerman, Bella Thorne, Dulcé Sloan","Action, Comedy, Drama",4.8
505,Love Mocktail,2020,153,Darling Krishna,"Darling Krishna, Milana Nagaraj, Amrutha Iyengar","Drama, Romance",8.2
506,The Man Standing Next,2020,114,Min-ho Woo,"Lee Byung-hun, Lee Sung-min, Kwak Do-won",Thriller,7.0
507,Violation,2020,107,"Dusty Mancinelli, Madeleine Sims-Fewer","Madeleine Sims-Fewer, Anna Maguire, Jesse LaVercombe","Drama, Horror",5.3
508,Captors,2020,93,James Cullen Bressack,"Yulia Klass, Bruce Davison, Josh Kelly",Thriller,3.7
509,Bad Hair,2020,102,Justin Simien,"Zaria Kelley, Corinne Massiah, Elle Lorraine","Comedy, Horror, Music",5.6
510,After Love,2020,89,Aleem Khan,"Joanna Scanlan, Nathalie Richard, Talid Ariss",Drama,7.3
511,Legacy of Lies,2020,101,Adrian Bol,"Scott Adkins, Anna Butkevich, Julia Bol","Action, Thriller",5.1
512,Black Beauty,2020,110,Ashley Avis,"Kate Winslet, Mackenzie Foy, Iain Glen","Drama, Family",6.4
513,Bayi Toplantisi,2020,114,"Bedran Güzel, Amirhossein Mehrabi","Ibrahim Büyükak, Onur Buldu, Dogu Demirkol",Comedy,4.6
514,Choke,2020,73,Gregory Hatanaka,"Shane Ryan-Reid, Scott Butler, Sarah Brine","Horror, Thriller",2.8
515,All Day and a Night,2020,121,Joe Robert Cole,"Ashton Sanders, Jeffrey Wright, Isaiah John",Drama,6.0
516,Slaxx,2020,77,Elza Kephart,"Romane Denis, Brett Donahue, Sehar Bhojani","Comedy, Horror",5.4
517,Villain,2020,97,Philip Barantini,"Craig Fairbrass, George Russo, Izuka Hoyle","Action, Crime, Drama",5.9
518,The Painter and the Thief,2020,106,Benjamin Ree,"Karl Bertil-Nordland, Barbora Kysilkova, Øystein Stene",Documentary,7.5
519,Initiation,2020,96,John Berardo,"Isabella Gomez, Lindsay LaVanchy, Froy Gutierrez","Crime, Drama, Horror",5.0
520,The Plot Against the President,2020,91,Amanda Milius,"Michael Anton, John O. Brennan, George Bush",Documentary,5.4
521,Chronicle of a Serial Killer,2020,99,Steve Stanulis,"Steve Stanulis, Dominique Swain, Brendan Sexton III",Thriller,3.5
522,Tolo Tolo,2020,90,Checco Zalone,"Checco Zalone, Souleymane Sylla, Romeo Landry Magrini","Comedy, Family",5.7
523,Into the Deep,2020,90,Emma Sullivan,Peter Madsen,"Documentary, Biography, Crime",6.5
524,Half Brothers,2020,96,Luke Greenfield,"Ian Inigo, Juan Pablo Espinosa, Bianca Marroquin","Comedy, Drama",6.1
525,Fatima,2020,113,Marco Pontecorvo,"Joaquim de Almeida, Goran Visnjic, Stephanie Gil","Drama, War",6.6
526,18 Presents,2020,115,Francesco Amato,"Vittoria Puccini, Benedetta Porcaroli, Edoardo Leo","Drama, Family, Fantasy",6.9
527,Doordarshan,2020,119,Gagan Puri,"Manu Rishi Chadha, Mahie Gill, Dolly Ahluwalia","Comedy, Drama",6.1
528,Deathstroke: Knights & Dragons - The Movie,2020,87,Sung Jin Ahn,"Chris Jai Alex, Sasha Alexander, Michael Chiklis","Animation, Action, Adventure",6.3
529,Parallel Minds,2020,86,Benjamin Ross Hayden,"Greg Bryk, Tommie-Amber Pirie, Neil Napier","Horror, Sci-Fi, Thriller",3.5
530,The Scary House,2020,100,Daniel Prochaska,"León Orlandianyi, Benno Rosskopf, Julia Koschitz","Drama, Horror, Mystery",5.4
531,Evil Eye,2020,90,"Elan Dassani, Rajeev Dassani","Sarita Choudhury, Sunita Mani, Bernard White","Horror, Mystery, Thriller",4.8
532,Valley Girl,2020,102,Rachel Lee Goldenberg,"Jessica Rothe, Josh Whitehouse, Jessie Ennis","Comedy, Musical, Romance",5.5
533,The Last Shift,2020,90,Andrew Cohn,"Richard Jenkins, Shane Paul McGhie, Da'Vine Joy Randolph","Comedy, Drama",5.8
534,Sweat,2020,106,Magnus von Horn,"Magdalena Kolesnik, Julian Swiezewski, Aleksandra Konieczna",Drama,6.6
535,Tribal Get Out Alive,2020,86,Matt Routledge,"Zara Phythian, Ross O'Hennessy, Rachel Warren","Action, Horror, Thriller",3.9
536,The Furnace,2020,116,Roderick MacKay,"Ahmed Malek, Baykali Ganambarr, Kaushik Das","Adventure, Drama, History",6.4
537,"My Donkey, My Lover & I",2020,96,Caroline Vignal,"Laure Calamy, Benjamin Lavernhe, Olivia Côte","Adventure, Comedy, Romance",6.5
538,Budapest Heist,2020,104,Balázs Lóth,"Béla Mészáros, Andrea Petrik, Ferenc Elek","Action, Comedy",3.8
539,Arthur & Merlin: Knights of Camelot,2020,90,Giles Alderson,"Richard Short, Tim Fellingham, Stella Stocker","Action, Adventure, History",3.3
540,Atkan Chatkan,2020,126,Shiv Hare,"Lydian Nadhaswaram, Sachin Kavetham, Tamanna Dipak","Drama, Musical",7.6
541,Andhaghaaram,2020,171,V. Vignarajan,"Vinoth Kishan, Arjun Das, Pooja Ramachandran","Horror, Mystery, Thriller",7.5
542,Bahut Hua Sammaan,2020,125,Ashish R. Shukla,"Sanjay Mishra, Ram Kapoor, Raghav Juyal","Comedy, Crime, Drama",7.2
543,Tar,2020,96,Aaron Wolf,"Timothy Bottoms, Graham Greene, Aaron Wolf","Adventure, Horror, Thriller",3.8
544,The Stand In,2020,101,Jamie Babbit,"Drew Barrymore, Sarah Jes Austell, Michael Zegen","Comedy, Drama",4.7
545,Girl,2020,92,Chad Faust,"Bella Thorne, Emma-Leigh Cullum, Elizabeth Saunders","Mystery, Thriller",4.9
546,Sun Children,2020,99,Majid Majidi,"Ali Nasirian, Javad Ezati, Tannaz Tabatabaei",Drama,7.1
547,Love Sarah,2020,97,Eliza Schroeder,"Celia Imrie, Shannon Tarbet, Shelley Conn","Comedy, Drama, Romance",6.2
548,Berlin Alexanderplatz,2020,183,Burhan Qurbani,"Welket Bungué, Albrecht Schuch, Jella Haase","Crime, Drama, Thriller",6.9
549,Se upp för Jönssonligan,2020,116,Tomas Alfredson,"Henrik Dorsin, Hedda Stiernstedt, David Sundin","Comedy, Crime",4.0
550,Tove,2020,103,Zaida Bergroth,"Alma Pöysti, Krista Kosonen, Shanti Roney","Biography, Drama",6.8
551,Middle Class Melodies,2020,135,Vinod Anantoju,"Anand Deverakonda, Varsha Bollamma, Abhiram","Comedy, Drama, Romance",7.5
552,Asalu Em Jarigindhante,2020,110,Srinivas Bandari,"Karunya Chowdary, KarronyaKatrynn, Mahendran",Drama,3.6
553,Surge,2020,105,Aneil Karia,"Ben Whishaw, Ryan McKen, Victor Olamide",Thriller,6.1
554,London Confidential,2020,77,Kanwal Sethi,"Mouni Roy, Purab Kohli, Kiren Jogi","Crime, Drama, Thriller",5.9
555,World Famous Lover,2020,154,"Kranthi Madhav, Gaurav Mahaur","Vijay Deverakonda, Raashi Khanna, Aishwarya Rajesh","Comedy, Drama, Romance",5.0
556,Gabriel's Inferno: Part One,2020,124,Tosca Musk,"Melanie Zanetti, Giulio Berruti, James Andrew Fraser",Romance,5.9
557,The Truffle Hunters,2020,84,"Michael Dweck, Gregory Kershaw","Piero Botto, Sergio Cauda, Maria Cicciù",Documentary,7.3
558,The Glorias,2020,147,Julie Taymor,"Julianne Moore, Alicia Vikander, Janelle Monáe","Biography, Drama, History",6.0
559,The Reckoning,2020,110,Neil Marshall,"Charlotte Kirk, Sean Pertwee, Steven Waddington","Adventure, Drama, Horror",4.8
560,Rams,2020,118,Jeremy Sims,"Sam Neill, Michael Caton, Wayne Blair","Comedy, Drama",6.5
561,Paydirt,2020,81,Christian Sesma,"Luke Goss, Val Kilmer, Mike Hatton","Crime, Thriller",3.9
562,A Perfect Enemy,2020,89,Kike Maíllo,"Tomasz Kot, Athena Strates, Marta Nieto","Drama, Thriller",5.5
563,Intersect,2020,119,Gus Holwerda,"James Morrison, Richard Dawkins, Jason Spisak","Horror, Sci-Fi, Thriller",3.5
564,I Hate Summer,2020,110,Massimo Venier,"Aldo Baglio, Giovanni Storti, Giacomo Poretti",Comedy,6.7
565,Friendsgiving,2020,95,Nicol Paone,"Malin Akerman, Kat Dennings, Jack Donnelly","Comedy, Drama",4.5
566,Fireball: Visitors from Darker Worlds,2020,97,"Werner Herzog, Clive Oppenheimer","Werner Herzog, Clive Oppenheimer, Simon Schaffer",Documentary,6.9
567,Tigertail,2020,91,Alan Yang,"Tzi Ma, Christine Ko, Hong-Chi Lee",Drama,6.6
568,"Te quiero, imbécil",2020,87,Laura Mañá,"Quim Gutiérrez, Natalia Tena, Alfonso Bassave",Comedy,5.9
569,Post Mortem,2020,115,Péter Bergendy,"Viktor Klem, Fruzsina Hais, Judit Schell","Horror, Mystery, Thriller",5.5
570,Embattled,2020,117,Nick Sarkisov,"Stephen Dorff, Elizabeth Reaser, Drew Starkey","Action, Drama, Sport",6.5
571,Cross the Line,2020,92,David Victori,"Mario Casas, Milena Smit, Elisabeth Larena","Drama, Thriller",6.2
572,The Windermere Children,2020,88,Michael Samuels,"Thomas Kretschmann, Romola Garai, Iain Glen","Drama, War",7.2
573,Psycho,2020,134,Mysskin,"Udhayanidhi Stalin, Aditi Rao Hydari, Nithya Menen","Crime, Thriller",6.1
574,Centigrade,2020,89,Brendan Walsh,"Genesis Rodriguez, Vincent Piazza, Benjamin Sokolow","Drama, Thriller",4.4
575,Stoker Hills,2020,91,Benjamin Louis,"Tony Todd, Steffani Brass, David Gridley","Horror, Mystery, Thriller",4.2
576,Wendy,2020,111,Benh Zeitlin,"Devin France, Yashua Mack, Gage Naquin","Drama, Fantasy, Thriller",5.7
577,Kappela,2020,113,Muhammed Musthafa,"Anna Ben, Sreenath Bhasi, Roshan Mathew","Comedy, Romance",7.5
578,Disturbing the Peace,2020,91,York Alec Shackleton,"Guy Pearce, Devon Sawa, Kelly Greyson","Action, Thriller",3.4
579,Bigfoot Family,2020,89,"Jérémie Degruson, Ben Stassen","Jules Medcraft, Kylian Trouillard, Alexis Victor","Animation, Adventure, Family",5.8
580,Virgin Bhanupriya,2020,111,Ajay Lohan,"Urvashi Rautela, Gautam Gulati, Rajiv Gupta","Comedy, Drama",2.5
581,Suraj Pe Mangal Bhari,2020,141,Abhishek Sharma,"Manoj Bajpayee, Diljit Dosanjh, Vijay Raaz",Comedy,5.9
582,Some Kind of Heaven,2020,81,Lance Oppenheim,"Dennis Dean, Lynn Henry, Anne Kincer",Documentary,7.2
583,Zappa,2020,129,Alex Winter,"Frank Zappa, Lonnie Lardner, Patrice Zappa","Documentary, Biography, History",7.5
584,Go Karts,2020,102,Owen Trevor,"William Lodder, Frances O'Connor, Anastasia Bampos","Family, Sport",5.9
585,The Woman Who Ran,2020,77,Hong Sang-soo,"Kim Min-hee, Lee Eun-mi, Kwon Hae-hyo",Drama,6.7
586,The Quarry,2020,98,Scott Teems,"Shea Whigham, Michael Shannon, Catalina Sandino Moreno","Crime, Drama, Mystery",5.5
587,Mama Weed,2020,104,Jean-Paul Salomé,"Isabelle Huppert, Yann Sundberg, Michaël Louchart","Comedy, Crime, Drama",6.3
588,Contra,2020,108,Sönke Wortmann,"Nilam Farooq, Christoph Maria Herbst, Hassan Akkouch",Comedy,6.8
589,Baba Parasi,2020,116,Selçuk Aydemir,"Ahmet Kural, Murat Cemcir, Devrim Yakut",Comedy,4.6
590,I Used to Go Here,2020,80,Kris Rey,"Gillian Jacobs, Jemaine Clement, Josh Wiggins","Comedy, Drama, Romance",5.6
591,The Serpent,2020,89,Gia Skova,"Gia Skova, Travis Aaron Wade, Nigel Vonas","Action, Thriller",2.9
592,Archenemy,2020,90,Adam Egypt Mortimer,"Jessica Allain, Mac Brandt, Skylan Brooks","Animation, Action, Adventure",5.0
593,And Tomorrow the Entire World,2020,111,Julia von Heinz,"Mala Emde, Noah Saavedra, Tonio Schneider","Crime, Drama, Romance",6.0
594,The Unhealer,2020,94,Martin Guigui,"Lance Henriksen, Natasha Henstridge, Adam Beach","Fantasy, Horror, Sci-Fi",5.4
595,The Pale Door,2020,96,Aaron B. Koontz,"Noah Segan, James Landry Hébert, Melora Walters","Drama, Horror, Western",4.4
596,1 Interrogation,2020,95,Dan Hewitt Owens,"Dan Hewitt Owens, Charidy Wronski, Tom Arnold",Crime,3.6
597,Unfit: The Psychology of Donald Trump,2020,83,Dan Partland,"Malcolm Nance, George Conway, John Gartner","Documentary, Biography",6.9
598,The Night,2020,105,Kourosh Ahari,"Shahab Hosseini, Niousha Noor, Leah Oganyan","Horror, Mystery, Thriller",5.5
599,Varane Avashyamund,2020,145,Anoop Sathyan,"Shobana, Suresh Gopi, Kalyani Priyadarshan","Comedy, Drama, Romance",6.9
600,Meka Suri,2020,86,Trinadh Velisila,"Abhinay, Naresh Byreddy, Sharat Kumar","Crime, Thriller",6.4
601,Fukushima 50,2020,122,Setsurô Wakamatsu,"Ken Watanabe, Takumi Saitô, Riho Yoshioka","Action, Drama, Thriller",6.1
602,Anelka: Misunderstood,2020,94,Franck Nataf,"Nicolas Anelka, Roman Abramovich, Fabrice Abriel","Documentary, Sport",6.4
603,Breaking Fast,2020,92,Mike Mosallam,"Haaz Sleiman, Michael Cassidy, Amin El Gamal","Comedy, Drama, Romance",6.7
604,Last Moment of Clarity,2020,90,"Colin Krisel, James Krisel","Zach Avery, Brian Cox, Udo Kier","Drama, Mystery, Thriller",5.2
605,Infamous,2020,100,Joshua Caldwell,"Bella Thorne, Jake Manley, Amber Riley","Crime, Drama, Romance",4.3
606,Comedy Couple,2020,117,Nachiket Samant,"Saqib Saleem, Shweta Basu Prasad, Pooja Bedi","Comedy, Romance",7.3
607,You Know Him,2020,105,Ercan Kesal,"Ercan Kesal, Selin Yeninci, Inanç Konukçu","Biography, Comedy, Drama",6.7
608,Chal Mera Putt 2,2020,124,Janjot Singh,"Amrinder Gill, Simi Chahal, Nasir Chinyoti",Drama,8.6
609,Aline,2020,126,Valérie Lemercier,"Valérie Lemercier, Sylvain Marcel, Danielle Fichaud","Biography, Comedy, Drama",6.3
610,Timecrafters: The Treasure of Pirate's Cove,2020,105,Rick Spalla,"Eric Balfour, Denise Richards, Malcolm McDowell","Adventure, Family, Fantasy",4.9
611,Ricos de Amor,2020,104,"Bruno Garotti, Jessica Blue, Anita Barbosa","Danilo Mesquita, Giovanna Lancellotti, Jaffar Bambirra","Comedy, Romance",6.0
612,Mother,2020,126,Tatsushi Ômori,"Masami Nagasawa, Sadao Abe, Halo Asada","Drama, Thriller",6.8
613,Mucho Mucho Amor: The Legend of Walter Mercado,2020,96,"Cristina Costantini, Kareem Tabsch","Walter Mercado, Willy Acosta, Lin-Manuel Miranda","Documentary, Biography",7.3
614,The People Upstairs,2020,82,Cesc Gay,"Javier Cámara, Griselda Siciliani, Belén Cuesta",Comedy,6.6
615,Yakuza and the Family,2020,136,Michihito Fujii,"Gô Ayano, Naoyuki Fernandez, Hayato Ichihara","Crime, Drama",7.1
616,My Heart Can't Beat Unless You Tell It To,2020,90,Jonathan Cuartas,"Patrick Fugit, Ingrid Sophie Schram, Owen Campbell","Drama, Horror",6.0
617,Die Känguru-Chroniken,2020,92,Dani Levy,"Marc-Uwe Kling, Dimitrij Schaad, Rosalie Thomass",Comedy,5.2
618,Fat Fiction,2020,102,Jennifer Isenhart,"Mark Hyman, Nina Teicholz, Gary Taubes",Documentary,7.7
619,Timmy Failure: Mistakes Were Made,2020,99,Tom McCarthy,"Winslow Fegley, Ophelia Lovibond, Wallace Shawn","Adventure, Comedy, Drama",6.0
620,Bad Candy,2020,103,"Scott B. Hansen, Desiree Connell","Zach Galligan, Corey Taylor, Derek Russo","Horror, Thriller",4.0
621,American Wisper,2020,91,Russ Emanuel,"Christian Barber, Naaji Sky Adzimah, Lanisha Javon Gholston","Crime, Thriller",3.9
622,Inmate Zero,2020,106,Russell Owen,"Jess Chanliau, Meg Alexandra, Gabz Barker",Horror,4.3
623,The Marriage Escape,2020,103,Johan Nijenhuis,"Herman Finkers, Johanna ter Steege, Leonie ter Braak","Comedy, Drama",7.4
624,The Edge of All We Know,2020,99,Peter Galison,"Shep Doeleman, Stephen Hawking, Andrew Strominger",Documentary,6.6
625,Totally Under Control,2020,123,"Alex Gibney, Ophelia Harutyunyan, Suzanne Hillinger","Alex Azar, Charlie Baker, Scott Becker",Documentary,7.6
626,Behind the Line: Escape to Dunkirk,2020,87,Ben Mole,"Joel Phillimore, James Haynes, Chris Simmons","Action, Drama, Sport",4.7
627,Charlatan,2020,118,Agnieszka Holland,"Ivan Trojan, Josef Trojan, Juraj Loj","Biography, Drama, History",6.8
628,Righteous Villains,2020,75,Savvas D. Michael,"Steven Berkoff, Gary Dourdan, Steven Brand","Crime, Thriller",3.4
629,Butchers,2020,92,Adrian Langley,"Simon Phillips, Michael Swatton, Julie Mainville","Horror, Thriller",4.6
630,Ask Tesadüfleri Sever 2,2020,124,"Ipek Sorak, Ömer Faruk Sorak","Nesrin Cavadzade, Yigit Kirazci, Elif Dogan","Drama, Romance",7.1
631,The Big Hit,2020,105,Emmanuel Courcol,"Kad Merad, David Ayala, Lamine Cissokho","Comedy, Drama",7.0
632,Under the Riccione Sun,2020,101,Younuts,"Cristiano Caccamo, Davide Calgaro, Matteo Oscar Giuggioli","Comedy, Drama, Romance",5.6
633,The Toll,2020,80,Michael Nader,"Jordan Hayes, Max Topplin, James McGowan","Horror, Thriller",5.3
634,Percy Vs Goliath,2020,99,Clark Johnson,"Christopher Walken, Roberta Maxwell, Christina Ricci","Biography, Drama",6.4
635,Mogul Mowgli,2020,89,Bassam Tariq,"Riz Ahmed, Aiysha Hart, Anjana Vasan","Drama, Music",6.6
636,Out of My League,2020,91,Alice Filippi,"Giuseppe Maggio, Ludovica Francesconi, Jozef Gjura","Comedy, Drama, Romance",6.2
637,Simmer,2020,96,"Nick Rush, Stefan van de Graaff","Marsuvio Sánchez, Richard Keep, Travis Su'a","Crime, Drama, Thriller",5.0
638,Fried Barry,2020,99,Ryan Kruger,"Gary Green, Chanelle de Jager, Brett Williams","Comedy, Horror, Sci-Fi",5.6
639,The Stranger by the Beach,2020,59,Akiyo Ôhashi,"Yurina Amami, Bryn Apprill, Justin Briner","Animation, Drama, Romance",7.2
640,The Claus Family,2020,96,Matthias Temmermans,"Jan Decleir, Mo Bakker, Bracha van Doesburgh","Comedy, Family, Fantasy",5.6
641,Light from the Tower,2020,77,Alex R. Wagner,"Sarah Rosengarten, Julia St. Pierre, Buckner Hinkle","Comedy, Drama, Mystery",2.4
642,Seized,2020,85,Isaac Florentine,"Scott Adkins, Mario Van Peebles, Steven Elder","Action, Adventure, Thriller",5.3
643,Zenek,2020,115,Jan Hryniak,"Jakub Zajac, Krzysztof Czeczot, Klara Bielawka","Biography, Music",2.7
644,Cut Throat City,2020,123,RZA,"Shameik Moore, Demetrius Shipp Jr., Denzel Whitaker","Action, Crime, Drama",4.9
645,Welcome to Chechnya,2020,107,David France,"Olga Baranova, David Isteev, Ramzan Kadyrov",Documentary,7.9
646,Love Affair(s),2020,122,Emmanuel Mouret,"Camélia Jordana, Niels Schneider, Vincent Macaigne","Comedy, Drama, Romance",6.9
647,Intuition,2020,116,Alejandro Montiel,"Luisana Lopilato, Joaquín Furriel, Rafael Ferro","Crime, Drama, Mystery",5.6
648,My First Summer,2020,80,Katie Found,"Arthur Angel, Markella Kavenagh, Steve Mouzakis","Drama, Romance",6.7
649,Charm City Kings,2020,125,Angel Manuel Soto,"Jahi Di'Allo Winston, Meek Mill, William Catlett",Drama,6.6
650,Ponmagal Vandhal,2020,123,JJ Fredrick,"Jyotika, Parthiban Radhakrishnan, Bhagyaraj","Drama, Thriller",6.7
651,The Disciple,2020,129,Chaitanya Tamhane,"Aditya Modak, Arun Dravid, Sumitra Bhave","Drama, Music",7.1
652,Christmas on the Square,2020,98,Debbie Allen,"Dolly Parton, Jenifer Lewis, Josh Segarra","Comedy, Family, Musical",5.2
653,Moon Rock for Monday,2020,100,Kurt Martin,"Aaron Jeffery, Nicholas Hope, David Field","Adventure, Drama",6.5
654,Father,2020,120,Srdan Golubovic,"Goran Bogdan, Boris Isakovic, Nada Sargin",Drama,7.6
655,Stage Mother,2020,93,Thom Fitzgerald,"Jacki Weaver, Lucy Liu, Adrian Grenier","Comedy, Drama, Music",6.6
656,Murder to Mercy: The Cyntoia Brown Story,2020,96,Daniel H. Birman,,Documentary,6.4
657,Nightlife,2020,111,Simon Verhoeven,"Julian Looman, Elyas M'Barek, Nicholas Ofczarek","Comedy, Romance",5.7
658,Held,2020,94,"Travis Cluff, Chris Lofing","Jill Awbrey, Bart Johnson, Travis Cluff","Horror, Mystery, Thriller",5.3
659,Digger,2020,101,Georgis Grigorakis,"Vangelis Mourikis, Argyris Pandazaras, Sofia Kokkali",Drama,7.3
660,"Love, Weddings & Other Disasters",2020,96,Dennis Dugan,"Maggie Grace, Jeremy Irons, Diane Keaton","Comedy, Romance",4.8
661,One Second,2020,104,Yimou Zhang,"Yi Zhang, Haocun Liu, Wei Fan","Comedy, Drama, History",7.1
662,"Ariana Grande: Excuse Me, I Love You",2020,97,"Rashad Ismail, Stuart Merser, Paul Dugdale","Ariana Grande, Natural, Eric Ingram","Documentary, Music",6.4
663,Sublet,2020,89,Eytan Fox,"John Benjamin Hickey, Niv Nissim, Lihi Kornowski","Comedy, Drama, Romance",7.0
664,Airplane Mode,2020,96,César Rodrigues,"Larissa Manoela, Erasmo Carlos, Katiuscia Canoro","Comedy, Drama, Romance",5.2
665,Shock Wave 2,2020,120,"Herman Yau, Shane Comley-White","Andy Lau, Ching-Wan Lau, Ni Ni","Action, Crime, Thriller",6.6
666,Gunda,2020,93,Victor Kossakovsky,Gunda,Documentary,7.1
667,The Best Years,2020,129,Gabriele Muccino,"Pierfrancesco Favino, Micaela Ramazzotti, Kim Rossi Stuart",Drama,6.7
668,Incision,2020,79,Ali Zamani,"Korrina Rico, Lee Kholafai, Costas Mandylor","Horror, Thriller",4.2
669,Fate/stay night [Heaven's Feel] III. spring song,2020,120,Tomonori Sudô,"Yu Asakawa, Michael Donovan, Melissa Fahn","Animation, Adventure, Drama",7.9
